LINE	NUM	ROOM	CHAR	Acte	TEXT_FR	TEXT_EN	INTEGRATION DES METADONNEES
A01N02_Kim_LIV_02090	02090	LIVINGROOM	Kim 	A01N02	 Maintenant, tu vas aller voir Léontine et lui demander une serpillère. Tu nettoies tout ça et tu ouvres les fenêtres avant que quelqu’un d’autre ne remarque cette horrible odeur… Et puis tu te reposes et tu me laisses faire. Je reviendrai te parler quand tu auras terminé.	Now, you’re going to see Léontine and ask for a mop. You’re going to clean all this up and open the windows before someone notices this horrible smell. And then you’re going to rest and let me handle things. I’ll come back to talk to you when you’re done.	Done
A01N02_Ern_LIV_02100	02100	LIVINGROOM	Ernest 	A01N02	D’accord, Kim.	Alright, Kim.	Done
A01N02_NAR_LIV_02110	02110	LIVINGROOM	NARRATEUR 	A01N02	 Je m’étonne moi-même… Je ne pensais pas pouvoir prendre aussi bien contrôle de la situation. En tout cas, on a eu chaud. Un peu plus et le Manoir devenait une fournaise.	I surprise myself… I didn’t think I could take over so well. Anyway, that was close. The Manor almost became an inferno.	Done
A01N02_Léo_LIV_02120	02120	LIVINGROOM	Léontine 	A01N02	 #Mme|M.|Mx# Luong ? J’ai vu Ernest partir vers le salon, suivi de Geoffroy, et, et… Geoffroy avait un grand couteau de cuisine à la main, et une expression que je ne lui ai jamais vue. Cela m’inquiète. A votre place, j’irai voir ce qu’il en est.	#Mrs.|Mr.|Mx.# Luong? I saw Ernest leave to the sittin’ room followed by Geoffroy, and, and… Geoffroy had a long kitchen knife in his hand, and I’ve never seen him like this. I’m worried. If I were you, I’d go see what’s goin’ on.	Done
A01N02_Kim_LIV_02130	02130	LIVINGROOM	Kim 	A01N02	 Merci, Léontine.	Thank you, Léontine.	Done
A01N02_???_BLA_02140	02140	BLACK_SCREEN	??? 	A01N02	 AAAAAAAAAAAAAAAAH !	"AAAAAAAAAAAAAAAAH !	"	Done
A01N02_NAR_BLA_02150	02150	BLACK_SCREEN	NARRATEUR 	A01N02	 Qu’est-ce que c’est ?	What’s that?	Done
A01N02_???_BLA_02160	02160	BLACK_SCREEN	??? 	A01N02	 AAAAAAAAAAAAAAAAAAAAAAAAAAAAAAAAAAAAH !	AAAAAAAAAAAAAAAAAAAAAAAAAAAAAAAAAAAAH !	Done
A01N02_NAR_BLA_02170	02170	BLACK_SCREEN	NARRATEUR 	A01N02	 Vite, il faut que j’aille voir !	Quick, I need to check on that!	Done
A01N02_NAR_BLA_02180	02180	BLACK_SCREEN	NARRATEUR 	A01N02	 …	…	Done
A01N02_NAR_BLA_02190	02190	BLACK_SCREEN	NARRATEUR 	A01N02	 …	…	INUTILE
A01N02_NAR_BLA_02200	02200	BLACK_SCREEN	NARRATEUR 	A01N02	 …	…	INUTILE
A01N02_NAR_BLA_02210	02210	BLACK_SCREEN	NARRATEUR 	A01N02	 Je n’oublierai jamais cette scène. Le sang sur le plancher. Le visage figé et surpris de mon ancien ami Ernest. Le manche du couteau qui dépassait encore de son flanc… Si j’avais écouté Léontine, aurais-je pu l’arrêter ? Et Geoffroy, aurais-je pu deviner qu’il avait des tendances meurtrières ? Il n’a même pas fui la scène. Il m’a regardé#e||•e# droit dans les yeux, avant de me dire doucement § « Vous devriez appeler la police, #Mme|M.|Mx# Luong. Et empêcher les autres de voir ce triste spectacle… » Il est resté là, tranquillement, jusqu’à l’arrivée des policiers, et les a suivis sans faire d’histoires. Je suis allé#e||•e# à son procès. Il a plaidé coupable, a témoigné sans hésitation § « J’ai toujours servi loyalement mes maîtres. Le Manoir a fait partie de leur famille pendant des générations. Jamais je n’aurai pu laisser un étranger manipulateur faire du mal à la petite Abigail que j’ai vu grandir, jamais je n’aurai pu le laisser mettre la main sur un héritage qui ne lui revenait pas de droit. J’ai fait ce que je ne pouvais pas ne pas faire. Je suis prêt à en subir toutes les conséquences. »	I’ll never forget what I saw§ the blood on the floor; the surprised face of my old friend Ernest. The handle of the knife coming out of his side… If I’d listened to Léontine, could I have stopped it? And Geoffroy, could I have guessed that he could be a cold blooded murderer? He didn’t even run away. He looked at me right in the eyes and said, “you should call the police, #Mrs.|Mr.|Mx.# Luong, and close the door so the others do not see this sinister scene…” He stayed there, calmly, until the police arrived, and was arrested without a word of protestation from him. I went to his trial. He pleaded guilty and testified without hesitation§ “I’ve always been loyal to my masters. The Manor has been part of the family for generations. I could never have let a manipulating stranger hurt dear Abigail who grew up under my care. I could never have let him embezzle an heirloom that wasn’t his by right. I did what I couldn’t not do. I am ready to suffer the consequences.”	Done
A01N02_NAR_BLA_02220	02220	BLACK_SCREEN	NARRATEUR 	A01N02	 Le Manoir a été partagé entre Abigail et Hippolyte.	The Manor was shared between Abigail and Hippolyte.	Done
A01N02_NAR_BLA_02230	02230	BLACK_SCREEN	NARRATEUR 	A01N02	 Le Manoir a été partagé entre Abigail, Hippolyte et Ophélie.	The Manor was shared between Abigail, Hippolyte and Ophélie.	Done
A01N02_NAR_BLA_02240	02240	BLACK_SCREEN	NARRATEUR 	A01N02	 Je ne me sentais plus d’accomplir ma mission après cet événement tragique. Tellement de regrets…	I couldn’t accomplish my task after this tragic event. I’ve so many regrets…	Done
A01N02_NAR_LIV_02250	02250	LIVINGROOM	NARRATEUR 	A01N02	 Qu’est-ce que…	What’s…	Done
A01N02_NAR_LIV_02260	02260	LIVINGROOM	NARRATEUR 	A01N02	 !	!	Done
A01N02_NAR_LIV_02270	02270	LIVINGROOM	NARRATEUR 	A01N02	 Quelques secondes seulement pour comprendre ce qu’il se passe. Pour voir Ernest, souriant, parler à Geoffroy. Pour voir le couteau que Geoffroy serre dans son dos. Pour comprendre qu’il compte l’utiliser, qu’il attend seulement le bon moment. Pour… trouver une idée.	I only have a few seconds to understand what’s happening; to see Ernest, smiling, and talking to Geoffroy; to see the knife Geoffroy’s holding behind his back; to understand that he really wants to use it, that he’s only waiting for the right moment; to… find an idea.	Done
A01N02_Kim_LIV_02280	02280	LIVINGROOM	Kim 	A01N02	 Appeler Geoffroy	Call Geoffroy	Done
A01N02_Kim_LIV_02290	02290	LIVINGROOM	Kim 	A01N02	 Geoffroy ! 	Geoffroy! 	Done
A01N02_NAR_LIV_02300	02300	LIVINGROOM	NARRATEUR 	A01N02	 Il sursaute.	He jumps.	Done
A01N02_Geo_LIV_02310	02310	LIVINGROOM	Geoffroy 	A01N02	 Oh, #Mme|M.|Mx# Luong…	Oh, #Mrs.|Mr.|Mx.# Luong…	Done
A01N02_NAR_LIV_02320	02320	LIVINGROOM	NARRATEUR 	A01N02	 Il sait que je sais. Il ne peut pas cacher le couteau à la fois d’Ernest et de moi.	He knows I know. He can’t hide the knife from me and him at the same time.	Done
A01N02_Kim_LIV_02330	02330	LIVINGROOM	Kim 	A01N02	 Geoffroy, s’il vous plait, j’ai besoin de m’entretenir sur le champ avec vous. C’est à propos de l’héritage. Je pense que vous serez rassuré.	Geoffroy, please, I need to talk to you about an urgent matter. It’s about the inheritance. I think you’ll feel reassured.	Done
A01N02_NAR_LIV_02340	02340	LIVINGROOM	NARRATEUR 	A01N02	 Il hésite, me scrutant pour deviner ce que je compte lui dire. Finalement, il acquiesce doucement.	He hesitates, scrutinizing me to guess at what I mean to say. Finally, he nods.	Done
A01N02_Kim_LIV_02350	02350	LIVINGROOM	Kim 	A01N02	 Ernest, peux-tu nous laisser quelques instants ?	Ernest, can you leave us a minute?	Done
A01N02_Ern_LIV_02360	02360	LIVINGROOM	Ernest 	A01N02	 Ah, euh, oui, bien sûr.	Ah, um, yes, of course.	Done
A01N02_NAR_LIV_02370	02370	LIVINGROOM	NARRATEUR 	A01N02	 Il a l’air perplexe… Autant qu’il le reste.	He seems puzzled… He might as well stay so.	Done
A01N02_NAR_LIV_02380	02380	LIVINGROOM	NARRATEUR 	A01N02	 Et Geoffroy… Si gêné.	And Geoffroy is so nervous.	Done
A01N02_Kim_LIV_02390	02390	LIVINGROOM	Kim 	A01N02	 Je ne suis pas sûr de croire ce que je viens de voir.	I’m not sure I believe what I just saw.	Done
A01N02_Geo_LIV_02400	02400	LIVINGROOM	Geoffroy 	A01N02	 Et pourtant.	And yet.	Done
A01N02_Kim_LIV_02410	02410	LIVINGROOM	Kim 	A01N02	 Vous l’auriez tué ?	You would have killed him?	Done
A01N02_Geo_LIV_02420	02420	LIVINGROOM	Geoffroy 	A01N02	 Sans l’ombre d’un regret. Comprenez, #Mme|M.|Mx# Luong… J’ai passé ma vie à servir les Castheran. Je ne peux pas supporter l’idée que ce petit cafard blesse Mme Castheran et récupère les droits sur le Manoir. Je préfère encore la prison.	Without the shadow of a doubt. You must understand, #Mrs.|Mr.|Mx.# Luong… I spent my whole life assisting the Castheran. I can’t stand the thought of this little cockroach hurting Mrs. Castheran and getting the rights on the Manor. I’d rather go to jail.	Done
A01N02_Kim_LIV_02430	02430	LIVINGROOM	Kim 	A01N02	 Comment ça, récupérer les droits ?	What do you mean, getting the rights on the Manor?	Done
A01N02_Geo_LIV_02440	02440	LIVINGROOM	Geoffroy 	A01N02	 Vous n’avez toujours pas compris ? M. Briant est après l’héritage, sous les ordres de Désirée.	Haven’t you found out yet? Mr. Briant is after the inheritance, under the orders of Désirée.	Done
A01N02_Kim_LIV_02450	02450	LIVINGROOM	Kim 	A01N02	 C’est donc ça…	So that’s what it was…	Done
A01N02_Geo_LIV_02460	02460	LIVINGROOM	Geoffroy 	A01N02	 Je ne laisserai pas une telle chose arriver. Vous ne pourrez pas m’en empêcher.	I can’t let such a thing happen. You cannot stop me.	Done
A01N02_NAR_LIV_02470	02470	LIVINGROOM	NARRATEUR 	A01N02	 Comment le convaincre de ne pas commettre ce meurtre ?	How can I convince him not to murder him?	Done
A01N02_NAR_LIV_02480	02480	LIVINGROOM	NARRATEUR 	A01N02	 Il va falloir que je fasse attention à ce que je dis…	I need to be careful of what I say…	Done
A01N02_Kim_LIV_02490	02490	LIVINGROOM	Kim 	A01N02	 Moi pas, Célestia oui.	I can’t, but Célestia can.	Done
A01N02_NAR_LIV_02500	02500	LIVINGROOM	NARRATEUR 	A01N02	 Il lève les sourcils, amusé par ma certitude, mais répond pourtant lentement et prudemment.	He frowns, amused by my certainty, but answers slowly and carefully.	Done
A01N02_Geo_LIV_02510	02510	LIVINGROOM	Geoffroy 	A01N02	 Feu-Mme Castheran est morte. Que pourrait-elle faire ?	What could the late Mrs. Castheran still do?	Done
A01N02_Kim_LIV_02520	02520	LIVINGROOM	Kim 	A01N02	 Sa volonté était très claire. Dans sa lettre, elle dit explicitement qu’elle ne veut pas qu’une tragédie salisse ce Manoir. Serez-vous prêt à lui désobéir à ce point ?	Her will was very clear. In her letter, she explicitely says she doesn’t want any tragedies to soil this manor. Would you be ready to disobey her so badly?	Done
A01N02_NAR_LIV_02530	02530	LIVINGROOM	NARRATEUR 	A01N02	 Il tousse pour se redonner contenance.	He coughs, trying to keep his composure.	Done
A01N02_Geo_LIV_02540	02540	LIVINGROOM	Geoffroy 	A01N02	 C’est vrai que… J’irai à l’encontre de… Mais…	That’s true… I’d go against her wishes… But…	Done
A01N02_Kim_LIV_02550	02550	LIVINGROOM	Kim 	A01N02	 Vous avez travaillé des dizaines d’années à son service, tout ça pour la trahir après sa mort ?	You worked decades for her, only to betray her after her death?	Done
A01N02_NAR_LIV_02560	02560	LIVINGROOM	NARRATEUR 	A01N02	 Il baisse les yeux, visiblement gêné. Ai-je fais mouche ?	His gaze lowers. Did I get this right?	Done
A01N02_Kim_LIV_02570	02570	LIVINGROOM	Kim 	A01N02	 Vous pouvez me faire confiance.	You can trust me.	Done
A01N02_Kim_LIV_02580	02580	LIVINGROOM	Kim 	A01N02	 Je ferai mon choix ce soir. Laissez-moi faire. Laissez Ernest. Si vous n’êtes pas satisfait de ma décision lorsque je la donnerai, vous serez libre de faire ce que vous souhaitez, mais promettez-moi de ne rien faire d’irrémédiable avant ce soir.	I’ll make my choice tonight. Let me handle things. Leave Ernest alone. If you’re not satisfied with my decision when I’ll give it, you are free to do as you wish, but promise me to wait until tonight.	Done
A01N02_Geo_LIV_02590	02590	LIVINGROOM	Geoffroy 	A01N02	 Je ne vous promets rien du tout, #Mme|M.|Mx# Luong. J’ai entendu les manigances que vous tolérez. Vous pourriez trouver tellement de plans, en une journée, pour m’empêcher de protéger Mme Castheran.	I will not promise anything, #Mrs.|Mr.|Mx.# Luong. I’ve heard you scheming with him. You could plot so much, in a day, to prevent me from protecting Mrs. Castheran.	Done
A01N02_NAR_LIV_02600	02600	LIVINGROOM	NARRATEUR 	A01N02	 Aïe… Je n’arrive pas à le convaincre !	Outch… I can’t convince him!	Done
A01N02_Kim_LIV_02610	02610	LIVINGROOM	Kim 	A01N02	 Vous êtes très attaché aux Castheran.	You’re very attached to the Castheran.	Done
A01N02_Geo_LIV_02620	02620	LIVINGROOM	Geoffroy 	A01N02	 Je suis prêt à tout pour eux.	I’m ready to do anything for them.	Done
A01N02_Kim_LIV_02630	02630	LIVINGROOM	Kim 	A01N02	 Mais les Castheran m’ont demandé de régler cette affaire. Pas à vous. A moi. N’allez-vous pas contre sa volonté en ne me laissant pas faire ce qu’ils m’ont demandé ?	But the Castheran asked me to deal with the inheritance. Not you. Me. Aren’t you going against their will if you do not let me do as they asked?	Done
A01N02_Geo_LIV_02640	02640	LIVINGROOM	Geoffroy 	A01N02	 Après ce que j’ai entendu, je n’ai pas confiance en vous.	After what I’ve heard, I do not trust you anymore.	Done
A01N02_Kim_LIV_02650	02650	LIVINGROOM	Kim 	A01N02	 Mais c’est la confiance que les Castheran ont mis en moi que vous remettez en cause.	But it is the trust the Castheran have for me that you are questioning.	Done
A01N02_Geo_LIV_02660	02660	LIVINGROOM	Geoffroy 	A01N02	 C’est malheureusement vrai.	That’s unfortunately true.	Done
A01N02_NAR_LIV_02670	02670	LIVINGROOM	NARRATEUR 	A01N02	 Est-ce que ça compte pour quelque chose ? Il se sent clairement piégé par la situation, entre son manque de confiance pour moi, et l’importance qu’il donne à bien faire son travail…	Does that count for anything? He clearly feels trapped by the situation, between his lack of trust for me and the importance of serving this family well…	Done
A01N02_Kim_LIV_02680	02680	LIVINGROOM	Kim 	A01N02	 Ernest n’est pas si mauvais.	Ernest isn’t that bad.	Done
A01N02_Kim_LIV_02690	02690	LIVINGROOM	Kim 	A01N02	 Quoique vous pensiez de ses plans, il ne mérite pas la mort.	Whatever you think of his plans, he doesn’t deserve to die.	Done
A01N02_Geo_LIV_02700	02700	LIVINGROOM	Geoffroy 	A01N02	 Et pourquoi seriez-vous plus à même que moi à décider de ce qu’il mérite ?	And why would you be in a better position than me to decide what he deserves?	Done
A01N02_Kim_LIV_02710	02710	LIVINGROOM	Kim 	A01N02	 Ce n’est pas moi. La justice…	It’s not I. Justice…	Done
A01N02_Geo_LIV_02720	02720	LIVINGROOM	Geoffroy 	A01N02	 La justice fait mal son travail. Si elle ne protège pas les victimes, à nous de le faire nous-mêmes.	Justice doesn’t do the work well. Laws do not protect the victims good enough. I shall do it myself.	Done
A01N02_Kim_LIV_02730	02730	LIVINGROOM	Kim 	A01N02	 Il y a une différence entre protéger Abigail et tuer Ernest !	There’s a big difference between protecting Abigail and killing Ernest!	Done
A01N02_Geo_LIV_02740	02740	LIVINGROOM	Geoffroy 	A01N02	 Et une autre avec s’allier avec lui. Non, décidément, je ne vois pas pourquoi votre avis pèserait plus que le mien.	And another one with becoming his ally. No, really, I don’t see why your point of view should weight more than mine.	Done
A01N02_NAR_LIV_02750	02750	LIVINGROOM	NARRATEUR 	A01N02	 Il est effrayant.	He is scary.	Done
A01N02_Geo_LIV_02760	02760	LIVINGROOM	Geoffroy 	A01N02	 C’est assez de vouloir me raisonner. Je suis sûr de moi.	Enough trying to reason with me. I’m sure of myself.	Done
A01N02_NAR_LIV_02770	02770	LIVINGROOM	NARRATEUR 	A01N02	 Il s’approche de la porte du salon, l’ouvre.	He opens the door of the sitting room.	Done
A01N02_Geo_LIV_02780	02780	LIVINGROOM	Geoffroy 	A01N02	 M. Briant ? Pourriez-vous revenir ?	Mr. Briant? Could you please come back?	Done
A01N02_Ern_LIV_02790	02790	LIVINGROOM	Ernest 	A01N02	 Bien sûr !	Of course!	Done
A01N02_NAR_LIV_02800	02800	LIVINGROOM	NARRATEUR 	A01N02	 Comprenant enfin ce que Geoffroy a en tête, je cours vers l’entrée. Trop tard. Ernest a à peine passer la porte qu’il se prend un coup de couteau.	As I understand what he means to do, I run towards the entrance. Too late. Ernest passes the door and already the knife strikes.	Done
A01N02_NAR_LIV_02810	02810	LIVINGROOM	NARRATEUR 	A01N02	 Geoffroy lève alors la tête et regarde nerveusement autour de lui. Mes mots ont-ils enfin de l’effet ?	Geoffroy’s head springs up, and he looks nervously around him. Did my words reach him?	Done
A01N02_Geo_LIV_02820	02820	LIVINGROOM	Geoffroy 	A01N02	 Vous avez entendu ?	Did you hear?	Done
A01N02_Kim_LIV_02830	02830	LIVINGROOM	Kim 	A01N02	 ?	?	Done
A01N02_Geo_LIV_02840	02840	LIVINGROOM	Geoffroy 	A01N02	 La musique…	The music…	Done
A01N02_NAR_LIV_02850	02850	LIVINGROOM	NARRATEUR 	A01N02	 Je tends l’oreille, mais je n’entends rien. Geoffroy secoue la tête et semble reprendre ses esprits.	I listen, but I can’t hear anything out of the ordinary. Geoffroy shakes his head and comes back to his senses.	Done
A01N02_Geo_LIV_02860	02860	LIVINGROOM	Geoffroy 	A01N02	 Ecoutez, vous avez raison – je n’ai pas de raison d’agir maintenant. Notre très chère feu-Mme Castheran vous a fait entièrement confiance, et je dois me plier à ses directives.	Listen, you’re right – I don’t have any reason to act now. Our dear late Mrs. Castheran trusted you entirely, and I have to fold to her orders.	Done
A01N02_NAR_LIV_02870	02870	LIVINGROOM	NARRATEUR 	A01N02	 Je soupire de soulagement. Un bain de sang évité… Si j’avais su que j’en arriverai là ! En tout cas, quoique je fasse, je ne peux plus envisager d’aider Geoffroy à recevoir le Manoir, contrat de travail ou non. Il est quand même prêt à assassiner un autre humain…	I sigh of relief. I just avoided a bloodbath… If I’d known things could get so far! Anyway, whatever I do, I can’t consider Geoffroy as an heir anymore. He was ready to kill another human being.	Done
A01N02_Geo_LIV_02880	02880	LIVINGROOM	Geoffroy 	A01N02	 Je vais retourner à mes occupations, en commençant par ranger ce couteau. Ne vous inquiétez pas pour M. Briant § il ne lui arrivera rien, en tout cas pas par ma faute.	I shall go back to my work. I’ll start by putting this knife away. Do not worry for Mr. Briant§ nothing will happen by my doings.	Done
A01N02_Kim_LIV_02890	02890	LIVINGROOM	Kim 	A01N02	 Appeler Ernest	Call Ernest	Done
A01N02_Kim_LIV_02900	02900	LIVINGROOM	Kim 	A01N02	 Ernest !	Ernest!	Done
A01N02_NAR_LIV_02910	02910	LIVINGROOM	NARRATEUR 	A01N02	 Ernest tourne la tête vers moi. Devant lui, Geoffroy sursaute. Il jette un rapide coup d’œil vers moi.	Ernest turns his head towards me. In front of him, Geoffroy starts. He takes a peep at me.	Done
A01N02_Geo_LIV_02920	02920	LIVINGROOM	Geoffroy 	A01N02	 Vous ne m’arrêterez pas.	You won’t stop me.	Done
A01N02_NAR_LIV_02930	02930	LIVINGROOM	NARRATEUR 	A01N02	 Il lève son couteau. Je me souviens, un peu tard, de sa promesse funèbre § celle de me faire regretter tout nouveau signe d’amitié envers Ernest.	He raises his knife. I remember, a little late, his funereal promise§ that I would regret any sign of friendship towards Ernest.	Done
A01N02_NAR_LIV_02940	02940	LIVINGROOM	NARRATEUR 	A01N02	 Je me jette en avant pour l’arrêter.	I jump forward to stop him.	Done
A01N02_NAR_LIV_02950	02950	LIVINGROOM	NARRATEUR 	A01N02	 Le couteau mord ma chair.	The knife bites my skin.	Done
A01N02_Geo_LIV_02960	02960	LIVINGROOM	Geoffroy 	A01N02	 Votre alliance est abjecte. Je ne la tolèrerai pas.	Your alliance is despicable. I won’t tolerate it.	Done
A01N02_NAR_LIV_02970	02970	LIVINGROOM	NARRATEUR 	A01N02	 Il donne un nouveau coup de couteau. Ernest est bien plus grand que moi, et c’est lui qui se le prend. Il n’arrive à rien faire pour se protéger, pris par surprise, désorienté par les événements. Il tombe à terre.	He uses the knife again. Ernest is taller than me, and he’s hit. He can’t do anything to protect himself, bewildered by the events. He falls to the ground.	Done
A01N02_NAR_BLA_02980	02980	BLACK_SCREEN	NARRATEUR 	A01N02	 Je n’oublierai jamais cette scène. Le sang sur le plancher. Le visage figé et surpris de mon ancien ami Ernest. Le manche du couteau qui dépassait encore de son flanc… Aurais-je pu deviner que Geoffroy avait des tendances meurtrières ? Il n’a même pas fui la scène. Il m’a regardé#e||•e# droit dans les yeux, avant de me dire doucement § « Vous devriez appeler la police, #Mme|M.|Mx# Luong. Et empêcher les autres de voir ce triste spectacle… »	I’ll never forget what I saw: the blood on the floor; the surprised face of my old friend Ernest. The handle of the knife coming out of his side… If I’d listened to Léontine, could I have stopped it? And Geoffroy, could I have guessed that he could be a cold blooded murderer? He didn’t even run away. He looked at me right in the eyes and said, “you should call the police, #Mrs.|Mr.|Mx.# Luong, and close the door so the others do not see this sinister scene…” 	Done
A01N02_NAR_BLA_02990	02990	BLACK_SCREEN	NARRATEUR 	A01N02	 Il est resté là, tranquillement, jusqu’à l’arrivée des policiers, et les a suivis sans faire d’histoires. Je suis allé#e||•e# à son procès. Il a plaidé coupable, a témoigné sans hésitation :  « J’ai toujours servi loyalement mes maîtres. Le manoir a fait partie de leur famille pendant des générations. Jamais je n’aurai pu laisser un étranger manipulateur faire du mal à Mme Castheran que j’ai vu grandir, jamais je n’aurai pu le laisser mettre la main sur un héritage qui ne lui revenait pas de droit. J’ai fait ce que je ne pouvais pas ne pas faire. Je suis prêt à en subir toutes les conséquences. »	He stayed there, calmly, until the police arrived, and was arrested without a word of protestation from him. I went to his trial. He pleaded guilty and testified without hesitation: “I’ve always been loyal to my masters. The Manor has been part of the family for generations. I could never have let a manipulating stranger hurt dear Abigail who grew up under my care. I could never have let him embezzle an heirloom that wasn’t his by right. I did what I couldn’t not do. I am ready to suffer the consequences.”	Done
A01N02_NAR_BLA_03000	03000	BLACK_SCREEN	NARRATEUR 	A01N02	 Je ne me sentais plus d’accomplir ma mission après cet événement tragique. Tellement de regrets…	I couldn’t accomplish my task after this tragic event. I’ve so many regrets…	Done
A01N02_Oph_TOY_03010	03010	TOYROOM	Ophélie 	A01N02	 B-Bonjour !	Hello!	Done
A01N02_Oph_TOY_03011	03010	TOYROOM	Ophélie 	A01N02	 B-Bonjour Kim ! V-vous v-voulez m-me d-dire quelque chose ?	Hello, K-Kim! D-did you want t-to say something?	Done
A01N02_Oph_TOY_03020	03020	TOYROOM	Ophélie 	A01N02	 B-Bonjour Kim ! Avez-vous trouvé une p-preuve de ma f-filiation ?	Hello, K-Kim! D-did you f-find a p-proof of my line of d-descent?	Done
A01N02_Oph_TOY_03021	03020	TOYROOM	Ophélie 	A01N02	J'ai réfléchi à comment prouver votre filiation.	I thought about how to prove your lineage.	Done
A01N02_Oph_TOY_03022	03020	TOYROOM	Ophélie 	A01N02	Non, pardon pour le dérangement.	No, sorry to bother you.	Done
A01N02_Kim_TOY_03030	03030	TOYROOM	Kim 	A01N02	 Je crois avoir une piste	I think so	Done
A01N02_Kim_TOY_03040	03040	TOYROOM	Kim 	A01N02	 Il y a un journal intime dans la chambre de Célestia. Malheureusement, il est sous verre, et je n’ai pas la clef de la vitrine.	There’s a diary in Célestia’s room. Unfortunately, it’s behind glass, and I don’t have the key.	Done
A01N02_Oph_TOY_03050	03050	TOYROOM	Ophélie 	A01N02	 Imp-possible de l’ouvrir…	You can’t open it…	Done
A01N02_Kim_TOY_03060	03060	TOYROOM	Kim 	A01N02	 Pour nous en tout cas, mais <color=#e27941ff>peut-être que quelqu’un dans la maison saurait comment faire</color>.	I can’t, but maybe <color=#e27941ff>someone else in the house knows how. </color>	Done
A01N02_NAR_TOY_03070	03070	TOYROOM	NARRATEUR 	A01N02	 Ophélie hoche la tête. Je vois à quel point elle compte sur moi.	Ophélie nods. I can see she’s counting on me.	Done
A01N02_Kim_TOY_03080	03080	TOYROOM	Kim 	A01N02	 Pas encore.	Not yet	Done
A01N02_Oph_TOY_03090	03090	TOYROOM	Ophélie 	A01N02	 A p-plus tard.	See you later then.	Done
A01N02_Oph_TOY_03100	03100	TOYROOM	Ophélie 	A01N02	 B-Bonjour Kim ! Avez-vous t-trouvé comment accéder au j-journal intime ?	Hello, K-Kim! Did you find a way to get the diary?	Done
A01N02_Kim_TOY_03110	03110	TOYROOM	Kim 	A01N02	 En partie…	Partially…	Done
A01N02_Kim_TOY_03120	03120	TOYROOM	Kim 	A01N02	 La vitrine est ouverte, mais Hippolyte refuse de me laisser le journal si je ne prouve pas être capable de l’ouvrir, d’un coup.	The display case is open, but Hippolyte doesn’t want to give me the diary unless I can open it on my first try.	Done
A01N02_Oph_TOY_03130	03130	TOYROOM	Ophélie 	A01N02	 V-vous savez comment f-faire ?	D-do you know how?	Done
A01N02_Kim_TOY_03140	03140	TOYROOM	Kim 	A01N02	 J’y réfléchis… Il y a plusieurs boutons qui font des sons, avec des symboles étranges dessus.	I’m thinking about it… There are keys with weird symbols making sounds.	Done
A01N02_Oph_TOY_03150	03150	TOYROOM	Ophélie 	A01N02	 P-Peut-être faut-il <color=#e27941ff>t-trouver quelque chose dans le M-Manoir en rapport avec la m-musique…</color>	M-maybe <color=#e27941ff>you should look for s-something linked t-to m-music? </color>	Done
A01N02_Kim_TOY_03160	03160	TOYROOM	Kim 	A01N02	 Oui.	Yes.	Done
A01N02_Kim_TOY_03170	03170	TOYROOM	Kim 	A01N02	 J’ai pu récupérer la clef grâce à Hippolyte !	I got the key thanks to Hippolyte!	Done
