LINE	NUM	ROOM	CHAR	Acte	TEXT_FR	TEXT_EN	INTEGRATION DES METADONNEES
A01N02_Kim_CEL_04480	04480	CELESTIASROOM	Kim 	A01N02	 Merci !	Thank you!	A faire
A01N02_NAR_CEL_04490	04490	CELESTIASROOM	NARRATEUR 	A01N02	 Je tends la main vers le journal, mais Hippolyte l’attrape avant moi.	I reach for the diary, but Hippolyte gets it before I do.	A faire
A01N02_Hip_CEL_04500	04500	CELESTIASROOM	Hippolyte 	A01N02	 Une seconde…	Just a moment…	A faire
A01N02_NAR_CEL_04510	04510	CELESTIASROOM	NARRATEUR 	A01N02	 Il recule d’un pas.	He steps back.	A faire
A01N02_Hip_CEL_04520	04520	CELESTIASROOM	Hippolyte 	A01N02	 Ce sont des affaires privées. Un journal intime. Je ne sais pas si j’ai envie que tu ailles mettre ton nez dans les sombres secrets de Célestia…	This is private. It’s a diary. I don’t know if I want you to nose in Célestia’s dark secrets.	A faire
A01N02_Kim_CEL_04530	04530	CELESTIASROOM	Kim 	A01N02	 Où trouverais-je une preuve qu’Ophélie est votre sœur, si pas là ?	How can I find proof that Ophélie is your sister, then?	A faire
A01N02_Hip_CEL_04540	04540	CELESTIASROOM	Hippolyte 	A01N02	 …	…	A faire
A01N02_NAR_CEL_04550	04550	CELESTIASROOM	NARRATEUR 	A01N02	 Il n’a pas l’air ravi…	He doesn’t seem happy.	A faire
A01N02_Kim_CEL_04560	04560	CELESTIASROOM	Kim 	A01N02	 Tu comptes m’empêcher de faire ce que je suis venu#e||•e# faire ici ?	Are you going to stop me from doing what I came here for?	A faire
A01N02_Hip_CEL_04570	04570	CELESTIASROOM	Hippolyte 	A01N02	 Non. Mais je ne peux pas te le donner comme ça.	No, I won’t. But I can’t just give it to you.	A faire
A01N02_NAR_CEL_04580	04580	CELESTIASROOM	NARRATEUR 	A01N02	 Peux ou veux ?	Can’t or won’t?	A faire
A01N02_Hip_CEL_04590	04590	CELESTIASROOM	Hippolyte 	A01N02	 Je veux d’abord la preuve que tu comprennes bien l’importance du Manoir. Tu es un#e||•e# inconnu#e||•e#. Alors je vais te laisser une chance. Tu vois le journal ? Il est fermé par une combinaison secrète. Ce sont des notes de piano… Le verrou ne saute que lorsqu’on appuie sur les touches dans le bon ordre, pour faire la mélodie préférée de Célestia. Elle nous la chantonnait souvent, quand on était enfant, et si tu t’en souviens, je voudrais bien croire que tu prends ta décision en ayant conscience de tous les souvenirs que nous avons ici.	First I want proof that you understand the importance of the Manor. You’re a stranger. So I’m going to give you one chance. Do you see the diary? It’s closed with a secret combination. Those are music keys… The lock only opens if you click on them in the right order to do Célestia’s favorite music. She often hummed it to us, when we were little, and if you remember it, I’ll believe you will take your decision with all our common memories in mind.	A faire
A01N02_NAR_CEL_04600	04600	CELESTIASROOM	NARRATEUR 	A01N02	 Aie… Je n’aurais qu’une chance. Mieux vaut tenter uniquement lorsque je serai sûr#e||•e# de moi.	Outch… I’ll only have one chance to succeed. I should only try when I’m sure of myself.	A faire
A01N02_Hip_CEL_04610	04610	CELESTIASROOM	Hippolyte 	A01N02	 Quand tu seras prêt#e||•e#, retourne me voir dans la salle de jeux.	When you are ready, come back to me in the toyroom.	A faire
A01N02_Kim_TOY_04620	04620	TOYROOM	Kim 	A01N02	 Je suis prêt#e||•e# à ouvrir le journal intime.	I’m ready to open the diary.	Done
A01N02_Hip_TOY_04630	04630	TOYROOM	Hippolyte 	A01N02	 Vas-y, je te regarde…	Go ahead, I’m watching you.	A faire
A01N02_NAR_TOY_04640	04640	TOYROOM	NARRATEUR 	A01N02	 Oh-oh… Je lui ai rarement vu un air aussi hautain.	Oh-oh… I’ve rarely seen him so haughty.	A faire
A01N02_Hip_TOY_04650	04650	TOYROOM	Hippolyte 	A01N02	 Tu me déçois, Kim. Je te pensais plus attaché que ça à notre enfance commune. Je n’ai pas confiance en ton jugement ; débrouille-toi pour aider Ophélie sans moi.	You disappoint me, Kim. I thought you were more attached to our childhood. I don’t trust your judgment; find a way to help Ophélie without me.	A faire
A01N02_NAR_TOY_04660	04660	TOYROOM	NARRATEUR 	A01N02	 Aïe. Je ne vais pas pouvoir aider Ophélie, elle risque d’être déçue…	Outch. I can’t help her then. She’s going to be sad.	A faire
A01N02_NAR_TOY_04670	04670	TOYROOM	NARRATEUR 	A01N02	 Hippolyte a l’air surpris.	Hippolyte is surprised.	A faire
A01N02_Hip_TOY_04680	04680	TOYROOM	Hippolyte 	A01N02	 Tu connais cette mélodie ? Ce n’est pas celle que nous chantonnait Célestia, mais nous l’écoutons souvent au Manoir. Je t’autorise un deuxième essai !	You know this song! It’s not the one Célestia used to hum all the time, but we often listened to it in the Manor. I’ll let you try again!	A faire
A01N02_NAR_TOY_04690	04690	TOYROOM	NARRATEUR 	A01N02	 Hippolyte sourit… Il a l’air vraiment content.	Hippolyte smiles… He seems very happy.	A faire
A01N02_Hip_TOY_04700	04700	TOYROOM	Hippolyte 	A01N02	 Bravo, Kim. J’avoue être surpris, je ne pensais pas que tu t’en souviendrais. Si tu trouves comme tu t’y attends la preuve qu’Ophélie est des nôtres, nous l’accueillerons à bras ouverts.	Congrats, Kim. I must say I’m surprised, I didn’t think you’d remember it. If you find the proof you’re looking for here, we’ll welcome Ophélie with open arms.	A faire
A01N02_Kim_TOY_04710	04710	TOYROOM	Kim 	A01N02	 Merci.	Thank you.	A faire
A01N02_Kim_TOY_04720	04720	TOYROOM	Kim 	A01N02	 Revenir plus tard	Come back later	A faire
A01N02_Kim_TOY_04730	04730	TOYROOM	Kim 	A01N02	 Je tenterai plus tard…	Actually, I’m going to try later on.	A faire
A01N02_Hip_TOY_04740	04740	TOYROOM	Hippolyte 	A01N02	 Je t’attends.	I’ll be waiting.	A faire
A01N02_Kim_TOY_04750	04750	TOYROOM	Kim 	A01N02	 J’ai trouvé des choses compromettantes sur Abigail.	I found compromising stuff about Abigail.	Done
A01N02_Kim_TOY_04760	04760	TOYROOM	Kim 	A01N02	 Apparemment, elle est très tyrannique et peut pousser les autres dans leurs retranchements, à se sentir mal, autant physiquement que moralement… C’est Célestia elle-même qui le dit.	Apparently, she is very tyrannic and pushes people until they crack, physically and mentally… Célestia wrote so herself.	Done
A01N02_Hip_TOY_04770	04770	TOYROOM	Hippolyte 	A01N02	 Ah, tu vois ! Je t’avais bien dit que tu n’aurais pas à fouiller longtemps pour trouver quelque chose. Abigail n’a jamais ressenti ni d’empathie ni de sympathie pour qui que ce soit. Elle est vénale et glaciale. Ses exigences sont inatteignables, et on se tue pour même pas un sourire. Tu penses vraiment qu’elle mérite d’être héritière ? Si tu fais ça, elle ne va jamais se remettre en question et écraser les autres.	Ah, you see! I told you if you searched a bit you’d find something. Abigail never felt any sympathy or empathy for anyone. She’s venal and cold. Her demands are impossible to fulfill, and you’d have to die trying for her to give you the most fleeting of smiles. Do you really think she deserves to be the heir? If you do this, she’ll never question herself and she will just crush everyone.	Done
A01N02_Hip_TOY_04780	04780	TOYROOM	Hippolyte 	A01N02	 Tu as bien vu comment elle te traite depuis ton arrivée.	You've seen how she's with you since you're here.	Done
A01N02_NAR_TOY_04790	04790	TOYROOM	NARRATEUR 	A01N02	 Il n’a pas tort. Il est le fils des Castheran, a été élevé ici, et tout me porte à croire que c’est lui qui mérite le plus d’être héritier. Peut-être devrais-je le choisir dès maintenant. A moins qu’il soit plus prudent de voir ce qu’Abigail a à dire pour sa défense ?	That’s right. He is the Castheran’s son, he grew up here, and everything tells me he deserves the most to be the heir. Maybe I should choose him right now. Unless I listen to what Abigail has to say to defend herself first?	Done
A01N02_Kim_TOY_04800	04800	TOYROOM	Kim 	A01N02	 Tu as raison. Je te choisis comme héritier.	You’re right. I choose you as the heir.	Done
A01N02_Kim_TOY_04810	04810	TOYROOM	Kim 	A01N02	 Allons l’annoncer aux autres.	Let’s tell the others.	Done
A01N02_Kim_TOY_04820	04820	TOYROOM	Kim 	A01N02	 Peut-être. Je vais réfléchir encore un peu.	Maybe. I’ll think about it some more.	Done
A01N02_Hip_TOY_04830	04830	TOYROOM	Hippolyte 	A01N02	 Oh, ne va pas faire semblant de croire ce ramassis d’âneries. Vous, les filles, vous vous défendez toujours entre vous. Je sais bien que ce n’est pas ça qui va te donner envie de me donner le Manoir. Surtout qu’Abigail a changé, depuis, elle est quand même un peu plus responsable qu’avant…	Oh, don’t act like you believe that. You girls are always defending each other. I know very well that it’s not some rubbish that will change your mind about giving me the Manor. Abigail’s changed since then, too, she’s more responsible than before.	Done
A01N02_Kim_TOY_04840	04840	TOYROOM	Kim 	A01N02	 Pourrais-tu m’en dire plus sur Geoffroy ?	Can you tell me more about Geoffroy?	Done
A01N02_Hip_TOY_04850	04850	TOYROOM	Hippolyte 	A01N02	 Qu’est-ce que veux savoir ?	What do you want to know?	Done
A01N02_NAR_TOY_04860	04860	TOYROOM	NARRATEUR 	A01N02	 Devrais-je être direct ?	Should I be frank?	Done
A01N02_Kim_TOY_04870	04870	TOYROOM	Kim 	A01N02	 Je n’ai pas vraiment de souvenirs de lui.	I don’t really have any memory of him.	Done
A01N02_Hip_TOY_04880	04880	TOYROOM	Hippolyte 	A01N02	 Il a changé, depuis ta dernière venue. Déjà, il n’avait pas les cheveux gris ! Mais il se tenait tout aussi droit, était tout aussi poli et tout aussi serviable.	He changed, since you last came. He has grey hair, for starter! But he’s still as upright, polite and obliging as always.	Done
A01N02_Hip_TOY_04890	04890	TOYROOM	Hippolyte 	A01N02	 Il n’a jamais fait un pas de travers, Geoffroy. Toujours là quand on en avait besoin, pour nous mettre un pansement si on tombait dans le jardin, pour nous apporter à boire quand on passait la journée à courir partout, pour nous donner envie de manger nos plats, pour nous appeler quand nos amis arrivaient…	He never misses a step, our Geoffroy. He was always here when we need him, to give us a band-aid when we fell in the garden, to bring us drinks when we ran everywhere all day, to motivate us to eat our food, to call us when our friends arrived at the gate…	Done
A01N02_Hip_TOY_04900	04900	TOYROOM	Hippolyte 	A01N02	 Et ça ce n’était que pour nous, gamins, mais il a aussi été un soutien indéniable pour nos parents, puis pour notre mère lorsque notre père est décédé. Tu peux lui faire confiance, si c’est ce que tu te demandes.	And that was just for us children, but he’s been a tremendous help for our parents, too, and our mother when father died. You can trust him, if that’s what you’re asking.	Done
A01N02_Kim_TOY_04910	04910	TOYROOM	Kim 	A01N02	 Merci beaucoup.	Thanks.	Done
A01N02_Kim_TOY_04920	04920	TOYROOM	Kim 	A01N02	 Au revoir.	Bye.	Done
A01N02_Geo_GAR_04930	04930	GARDEN	Geoffroy 	A01N02	 Ah, #Mme|M.|Mx# Luong ! Que puis-je faire pour vous ?	Ah, #Mrs.|Mr.|Mx.# Luong! What can I do for you?	Done
A01N02_Geo_GAR_04940	04940	GARDEN	Geoffroy 	A01N02	 Ah, #Mme|M.|Mx# Luong ! Avez-vous pris le temps de chercher mon contrat ? 	Ah, #Mrs.|Mr.|Mx.# Luong! Did you find the time to look for my contract? 	Done
A01N02_NAR_GAR_04950	04950	GARDEN	NARRATEUR 	A01N02	 Devrais-je lui en parler maintenant ? Je ne suis pas sûr d’en savoir assez sur tout le monde…	Should I talk about it now? I’m not sure I know enough about everyone…	Done
A01N02_Kim_GAR_04960	04960	GARDEN	Kim 	A01N02	 Non, pas encore.	Not yet.	Done
A01N02_Geo_GAR_04970	04970	GARDEN	Geoffroy 	A01N02	 Non ? Oh, ce n’est pas grave… C’est à moi de vous servir. Que puis-je pour vous ?	No? Oh, it’s okay, it’s my job to serve you and not the other way around. What can I do for you?	Done
A01N02_Kim_GAR_04980	04980	GARDEN	Kim 	A01N02	Oui	Yes, I did	Done
A01N02_Kim_GAR_04990	04990	GARDEN	Kim 	A01N02	 Oui, il était sur le bureau de Célestia. Le voilà.	It was on Célestia’s desk, here you go.	Done
A01N02_Geo_GAR_05000	05000	GARDEN	Geoffroy 	A01N02	 Oh ! Je… Merci mille fois, je vous suis vraiment redevable.	Oh! I… Thank you a thousand times, I’m forever grateful.	Done
A01N02_Geo_GAR_05010	05010	GARDEN	Geoffroy 	A01N02	 Vous voyez donc ici que je fais bien partie des héritiers potentiels.	You can see then that I could also be an heir.	Done
A01N02_Geo_GAR_05011	05010	GARDEN	Geoffroy 	A01N02	C’est écrit qu’ils s’engagent à ce que je reste toujours au Manoir en cas de loyaux services pendant quarante ans.	It’s written. They promised to let me stay in the Manor if I served them loyally for forty years.	Done
A01N02_Geo_GAR_05012	05010	GARDEN	Geoffroy 	A01N02	Ils considèrent qu’une vie à les servir mérite bien de pouvoir y rester attaché même après leur mort, et que je ne devrai pas à chercher un lieu où passer ma retraite.	They think a life of service is worth staying here even after their death, so I don’t have to find where to spend my old days.	Done
A01N02_Geo_GAR_05020	05020	GARDEN	Geoffroy 	A01N02	 Avez-vous l’intention de respecter leur vœu ? Il est particulièrement limpide…	Will you respect their wish? It’s particularly clear…	Done
A01N02_NAR_GAR_05030	05030	GARDEN	NARRATEUR 	A01N02	 Que dois-je faire ? Il a l’air de tellement espérer et de tellement tenir au Manoir.	What should I do? He really hopes to stay here.	Done
A01N02_NAR_GAR_05031	05030	GARDEN	NARRATEUR 	A01N02	D’un autre côté, leurs enfants sont aussi héritiers potentiels, et les Castheran ne sont pas si clairs que ça § Rester au Manoir et obtenir le Manoir sont deux choses différentes, non ?	On the other hand, the Castheran’s children are also potential heirs, and they aren’t that clear§ staying in the Manor and getting it are two different things, aren’t they?	Done
A01N02_NAR_GAR_05032	05030	GARDEN	NARRATEUR 	A01N02	Je vais tergiverser.	I need to stalk. 	Done
A01N02_Kim_GAR_05040	05040	GARDEN	Kim 	A01N02	 Je ferai tout pour respecter leur vœu.	I’ll do everything to respect their wish	Done
A01N02_Geo_GAR_05050	05050	GARDEN	Geoffroy 	A01N02	 Je n’en doute pas.	I don’t doubt it.	Done
A01N02_Kim_GAR_05060	05060	GARDEN	Kim 	A01N02	 Mais pour ça, je vais avoir besoin d’enquêter pour trouver les preuves de vos bons et loyaux services.	But for that, I need to investigate first to have proof of your loyal services.	Done
A01N02_Kim_GAR_05061	05060	GARDEN	Kim 	A01N02	Votre témoignage ne peut pas suffire, bien que j’aie toute confiance en vous.	Your testimony can’t be enough, although I trust you.	Done
A01N02_Kim_GAR_05070	05070	GARDEN	Kim 	A01N02	 Je dois encore en apprendre davantage sur les droits des autres successeurs.	I still need to learn more about the rights of the other successors	Done
A01N02_Geo_GAR_05080	05080	GARDEN	Geoffroy 	A01N02	 Je comprends.	I understand.	Done
A01N02_Kim_GAR_05090	05090	GARDEN	Kim 	A01N02	 J’en profiterai pour me renseigner sur vos bons et loyaux services.	I’ll take the opportunity to get more information about your loyal services.	Done
A01N02_Kim_GAR_05100	05100	GARDEN	Kim 	A01N02	 Il me semble que leurs enfants ont quand même davantage de droits que vous.	I think their children have more rights than you	Done
A01N02_Geo_GAR_05110	05110	GARDEN	Geoffroy 	A01N02	 Je comprends.	I understand.	Done
A01N02_Kim_GAR_05120	05120	GARDEN	Kim 	A01N02	 Et puis, ce contrat en lui-même ne suffit pas. Il me faut plus que votre témoignage, je dois trouver des preuves de vos bons et loyaux services.	Also, the contract itself isn’t enough. I need more than your testimony. I need to find proof of your loyal services.	Done
A01N02_Geo_GAR_05130	05130	GARDEN	Geoffroy 	A01N02	 Oh, vous n’aurez aucun mal à cela ! N’importe qui ici parlera en ma faveur !	Oh, it won’t be hard! Everyone here will speak in my favor.	Done
A01N02_Kim_GAR_05140	05140	GARDEN	Kim 	A01N02	 Vraiment ? Ce n’est pas ce que Léontine m’a dit…	Really? That’s not what Léontine told me…	Done
A01N02_Geo_GAR_05150	05150	GARDEN	Geoffroy 	A01N02	 Léontine ? Léontine parle contre moi ? Mais…	Léontine? Did she say something against me? But…	Done
A01N02_Geo_GAR_05151	05150	GARDEN	Geoffroy 	A01N02	C’est qu’elle est fourbe et menteuse ! Ne donnez pas trop de poids à ce qu’elle dit.	She’s deceitful and a compulsive liar. Don’t give too much weight to what she says.	Done
A01N02_Geo_GAR_05152	05150	GARDEN	Geoffroy 	A01N02	Je suis sûr qu’en insistant, elle bougonnera qu’elle disait ça comme ça.	I’m sure if you ask again, she’ll go back on her words.	Done
A01N02_Kim_GAR_05160	05160	GARDEN	Kim 	A01N02	 Nous verrons.	We’ll see.	Done
A01N02_Geo_GAR_05170	05170	GARDEN	Geoffroy 	A01N02	 Je vous laisse chercher. En attendant, je me tiens encore et toujours à votre disposition.	I’ll let you look for what you need. In the meantime, I’m as always at your disposal.	Done
A01N02_NAR_GAR_05180	05180	GARDEN	NARRATEUR 	A01N02	 Si je veux le choisir comme héritier, je ferai mieux d’interroger les personnes qui l’ont connu au Manoir.	If I want to choose him as the heir, I’d better question everyone who knew him here.	Done
A01N02_Geo_GAR_05190	05190	GARDEN	Geoffroy 	A01N02	 A votre service.	At your disposal.	Done
A01N02_Kim_GAR_05200	05200	GARDEN	Kim 	A01N02	 Interroger Geoffroy sur son passé	Ask Geoffroy about his past	Done
A01N02_Kim_GAR_05210	05210	GARDEN	Kim 	A01N02	 Je me demandais, comment avez-vous commencé à travailler ici ?	I was wondering, how did you start working here?	Done
A01N02_Geo_GAR_05220	05220	GARDEN	Geoffroy 	A01N02	 Oh, je suis là depuis tellement longtemps ! Je travaillais pour les grand-parents de Mme Castheran…	Oh, I’ve been here for such a long time! I used to work for Mrs Castheran’s grand-parents…	Done
A01N02_Kim_GAR_05230	05230	GARDEN	Kim 	A01N02	 Célestia ?	Célestia’s?	Done
A01N02_Geo_GAR_05240	05240	GARDEN	Geoffroy 	A01N02	 Non, non, Abigail, bien sûr.	No, no, Abigail’s, of course.	Done
A01N02_Geo_GAR_05241	05240	GARDEN	Geoffroy 	A01N02	En vérité, à l’époque, je cherchais n’importe quel petit travail pour aider mes parents dans leur quotidien.	In truth, back then, I was ready for any little job to help my parents in their everyday life.	Done
A01N02_Geo_GAR_05242	05240	GARDEN	Geoffroy 	A01N02	Nous sommes arrivés dans ce village breton, tout le monde se méfiait de nous, à ne pas savoir d’où on venait et ce qu’on venait faire ici…	We arrived in this Breton village, and everyone was suspicious of us, because they didn’t know where we came from and what we were doing here…	Done
A01N02_Kim_GAR_05250	05250	GARDEN	Kim 	A01N02	 Qu’est-ce qu’il s’est passé ?	What happened?	Done
A01N02_Geo_GAR_05260	05260	GARDEN	Geoffroy 	A01N02	 Mon père a ouvert sa boulangerie et s’est fait haïr de l’autre boulanger du village.	My father opened a bakery and started being hated by the one already on business. Well.	Done
A01N02_Geo_GAR_05261	05260	GARDEN	Geoffroy 	A01N02	Bon… Moi, personne ne me voulait nulle part, le grand gamin de dix-sept ans… J’étais tellement gauche, à l’époque.	As for me, no one wanted a seventeen years old teen at their service. I was so clumsy, back then.	Done
A01N02_Geo_GAR_05270	05270	GARDEN	Geoffroy 	A01N02	 Il n’y a que les Castheran qui ont eu la gentillesse de m’accueillir et de rire de mes maladresses.	The Castheran were the only ones nice enough to welcome me and laugh of my faux-pas.	Done
A01N02_Geo_GAR_05271	05270	GARDEN	Geoffroy 	A01N02	Jamais un reproche ! J’ai vu feu-Mme Castheran grandir… Elle était encore bébé quand je suis arrivé.	Never a single blame! I saw the late Mrs. Castheran grow up… She was still a baby when I arrived.	Done
A01N02_Geo_GAR_05272	05270	GARDEN	Geoffroy 	A01N02	Puis je l’ai vue partir, et le Manoir est devenu beaucoup plus vide sans elle – elle n’a pas de frères et sœurs, vous savez, et les relations avec les cousins sont compliquées.	Then I saw her leave, and the Manor became so much emptier without her – she doesn’t have siblings, you know, and relationships with her cousins are complicated.	Done
A01N02_Geo_GAR_05273	05270	GARDEN	Geoffroy 	A01N02	Puis elle est revenue au bras de feu-M. Castheran.	She came back at the arm of the late Mr. Castheran, and…	Done
A01N02_Kim_GAR_05280	05280	GARDEN	Kim 	A01N02	 Augustin, c’est bien ça ?	Augustin, you mean?	Done
A01N02_NAR_GAR_05290	05290	GARDEN	NARRATEUR 	A01N02	 Il hoche la tête.	He nods.	Done
A01N02_Geo_GAR_05300	05300	GARDEN	Geoffroy 	A01N02	 Exactement. Il a accepté de prendre son nom, elle tenait tant à le garder.	Exactly. He accepted to take her name, it was so important for her to keep it.	Done
A01N02_Geo_GAR_05301	05300	GARDEN	Geoffroy 	A01N02	La vie a repris son cours, avec les deux enfants qui n’ont pas tardé, Léontine qui est arrivée pour s’en occuper.	Life started again, with two children rapidly enough, and Léontine who came to take care of them too.	Done
A01N02_Kim_GAR_05310	05310	GARDEN	Kim 	A01N02	 Jusqu’à aujourd’hui.	Until now.	Done
A01N02_Kim_GAR_05320	05320	GARDEN	Kim 	A01N02	 Merci, ce sera tout pour l’instant.	Thank you, that will be all.	Done
A01N02_Kim_GAR_05330	05330	GARDEN	Kim 	A01N02	 C’est Abigail que j’ai vu là ?	Is it Abigail I just saw?	A faire
A01N02_Geo_GAR_05340	05340	GARDEN	Geoffroy 	A01N02	 Oui, malgré toutes mes sollicitations, elle insiste pour que ce soit elle qui arrose chaque fleur du jardin… <color= #9d4184ff>Elle dit qu’elle doit elle aussi s’occuper de sa demeure, et qu’il n’y a qu’en passant du temps sur quelque chose qu’on en vient à vraiment l’aimer.</color> Elle se met à genoux dans la terre pour arracher les mauvaises herbes, couper, nettoyer… Je suis si gêné de ne pas le faire moi-même, mais elle m’a formellement interdit de toucher aux arrosoirs, et je suis là pour obéir.	Yes, it is. Despite all my appeals, she insists on watering each and every flower herself… <color= #9d4184ff>She says she must take care of her home too, and that only by spending time on things can we really come to love them.</color> She kneels on the soil to pull out the weeds, cut, nurture… I’m so ashamed not to do it myself, but she formally forbade me to touch the watering cans, and I’m here to obey.	A faire
A01N02_NAR_GAR_05350	05350	GARDEN	NARRATEUR 	A01N02	 Surprenant.	Surprising.	A faire
A01N02_NAR_GAR_05360	05360	GARDEN	NARRATEUR 	A01N02	 Tiens, Abigail ? C’est elle qui arrose les fleurs ? Pourquoi n’est-ce pas Geoffroy qui s’en charge ?	Is that Abigail? Is she the one watering the plants? Why isn’t it Geoffroy? 	Done
A01N02_Abi_GAR_05370	05370	GARDEN	Abigail 	A01N02	 Vous n’avez pas autre chose à faire que de vous promener dans mes jardins ? Je croyais que vous deviez choisir un héritier.	Don’t you have something better to do than wander around in the gardens? I thought you were here to choose an heir.	Done
A01N02_NAR_GAR_05380	05380	GARDEN	NARRATEUR 	A01N02	 Toujours aussi sympathique, dis donc…	Nice as always I see…	Done
A01N02_Kim_GAR_05390	05390	GARDEN	Kim 	A01N02	 Pardonnez-moi, je ne voulais pas vous offenser. 	Forgive me, I didn’t want to offend you.	Done
A01N02_Abi_GAR_05400	05400	GARDEN	Abigail 	A01N02	 Mph.	Mph.	Done
A01N02_Kim_GAR_05410	05410	GARDEN	Kim 	A01N02	 Puis-je vous poser quelques questions ?	May I ask you some questions?	Done
A01N02_Abi_GAR_05420	05420	GARDEN	Abigail 	A01N02	 Faites donc, alors, mais faites vite, je suis occupée.	Do it but do it fast, I am busy.	Done
A01N02_Kim_GAR_05430	05430	GARDEN	Kim 	A01N02	 J’ai besoin de vous parler pour pouvoir le faire.	I need to talk to you to do that.	Done
A01N02_Abi_GAR_05440	05440	GARDEN	Abigail 	A01N02	 Faites donc, alors, mais faites vite, je suis occupée.	Do it but do it fast, I am busy.	INUTILE
A01N02_Kim_GAR_05450	05450	GARDEN	Kim 	A01N02	 Oh, mais mon choix est évident ! Ce sera forcément la gamine hautaine, froide et méprisante qui remportera le gros lot !	Oh, but my choice is obvious! It will be the haughty, cold and despising child!	Done
A01N02_Abi_GAR_05460	05460	GARDEN	Abigail 	A01N02	 Etes-vous en train de vous permettre de m’insulter dans mon propre Manoir ?	Are you insulting me in my own Manor?	Done
A01N02_Kim_GAR_05470	05470	GARDEN	Kim 	A01N02	 Il n’est pas à <i>toi</i>, Abigail, et je peux bien me permettre tout ce que je veux, j’en ai le droit, j’ai été invité ici !	It isn’t <i>yours</i>, Aby, and I can do whatever I want, I was invited here!	Done
A01N02_Abi_GAR_05480	05480	GARDEN	Abigail 	A01N02	 Les hôtes ont leurs devoirs, mais leurs invités aussi.	Hosts have their duties, but so do guests.	Done
A01N02_Kim_GAR_05490	05490	GARDEN	Kim 	A01N02	 Et que vas-tu faire ? C’est à moi de choisir à qui ira l’héritage. A ta place, je me ferai plus gentille.	So what are you going to do? I’m the one choosing who gets the inheritance. If I were you, I’d be nicer.	Done
A01N02_Abi_GAR_05500	05500	GARDEN	Abigail 	A01N02	 Du chantage, maintenant ? Mes parents ont eu tort de vouloir mettre nos affaires entre les mains d’un#e||•e# inconnu#e||•e#. J’y étais déjà opposée de base, j’ai voulu respecter leur volonté, tout ça pour que leur confiance soit bafouée sous leur toit. Vous n’êtes plus l #a|e|ae#e bienvenu#e||•e# ici. Nous règlerons nos affaires dans les règles, devant une vraie juridiction. Vous pouvez disposer.	Blackmail now? My parents were wrong to want a stranger to decide of our fate. I was against it from the start, but I decided to honor their will… All of that to see their trust tarnished under their roof. You are not welcomed here anymore. We will take care of our business in the rules of art, before a real jurisdiction. You may leave.	Done
